{
  "schema_version": "1.0",
  "run_id": "20260711T185948348-1bf491e6",
  "status": "findings",
  "findings": [
    {
      "finding_id": "review-spending-limit-reached",
      "source_run_id": "20260711T185948348-1bf491e6",
      "location": {
        "path": ".review/changes.diff"
      },
      "severity": "blocking",
      "kind": "escalation",
      "design_reference": "review spending limit reached",
      "comment": "This automated code review reached its spending limit for this change: it has run 4 review rounds (the limit is 2) and a blocking item is still open. The limit is a budget guard - it caps how much AI-usage a single review can spend before a person decides whether to keep going - so the review PAUSED here instead of continuing to spend. This is not a clean pass: the latest change was not reviewed, and treating it as \"no findings\" would be wrong. To continue, a person can approve more review budget for this change (run `specrew review --remediate more-time`, or approve the assistant doing it), or fix the open blocking item so the next review passes on its own.",
      "disposition": "escalated_to_human",
      "resolution": {
        "state": "escalated",
        "fix_evidence_ref": null,
        "rationale": null
      }
    }
  ],
  "created_at": "2026-07-11T18:59:58Z"
}