{
  "schema_version": "1.0",
  "run_id": "20260710T220201403-7634fabc",
  "status": "findings",
  "findings": [
    {
      "finding_id": "f1",
      "source_run_id": "20260710T220201403-7634fabc",
      "location": {
        "path": "scripts/internal/lint-self-leak.ps1",
        "line_start": 55,
        "line_end": 57
      },
      "severity": "blocking",
      "kind": "escalation",
      "design_reference": "integration/API lens; specs/198-beta2-hardening/contracts/198-beta2-hardening.md:15 (repo-side version-locked), FR-037, NFR-001/NFR-007",
      "comment": "HUMAN DECISION REQUIRED: final review round confirms prior blocking finding remains unresolved and no worktree-visible human deferral covers it. Read-SelfLeakDenyList still accepts every non-empty schema_version instead of enforcing supported version 1.0, and tests/unit/self-leak-lint.tests.ps1 still asserts presence only, with no unknown-version exit-2 abuse test. Stop the autonomous review/fix loop; a human must decide whether to require the version lock and paired test now or record an approved deferral in a worktree-visible decision artifact naming where the work is carried.",
      "disposition": "escalated_to_human",
      "resolution": {
        "state": "unresolved",
        "fix_evidence_ref": null,
        "rationale": null
      }
    }
  ],
  "created_at": "2026-07-10T22:04:04Z"
}