{
  "schema_version": "1.0",
  "run_id": "20260710T162724765-73700590",
  "status": "findings",
  "findings": [
    {
      "finding_id": "f1",
      "source_run_id": "20260710T162724765-73700590",
      "location": {
        "path": "tests/unit/self-leak-lint.tests.ps1",
        "line_start": 101,
        "line_end": 103
      },
      "severity": "blocking",
      "kind": "test-integrity",
      "design_reference": "specs/198-beta2-hardening/tasks.md T005; specs/198-beta2-hardening/spec.md NFR-002/NFR-007; specs/198-beta2-hardening/iterations/001/review.md T005",
      "comment": "T005 is marked done on an annotated green-with-reason fixture, but the test only checks for the string [annotated]. The implementation never extracts or prints the annotation reason: lint-self-leak.ps1 stores only the deny-list reason and emits \"[annotated] file:line matched (class)\". This means a regression that omits the human audit reason from the legitimate path still passes, falsifying the claimed transparency/paired-test evidence for annotated escapes.",
      "disposition": "open",
      "resolution": {
        "state": "unresolved",
        "fix_evidence_ref": null,
        "rationale": null
      }
    }
  ],
  "created_at": "2026-07-10T16:32:37Z"
}