{
  "schema_version": "1.0",
  "run_id": "20260712T010609683-a54196ec",
  "status": "findings",
  "findings": [
    {
      "finding_id": "f1",
      "source_run_id": "20260712T010609683-a54196ec",
      "location": {
        "path": "scripts/internal/continuous-co-review/worktree-review-orchestrator.ps1",
        "line_start": 568,
        "line_end": 578
      },
      "severity": "blocking",
      "kind": "escalation",
      "design_reference": "T034/T034b; specs/198-beta2-hardening/iterations/003/design-analysis.md error-handling expectations; code-implementation lens",
      "comment": "HUMAN DECISION REQUIRED: final-round verification confirms prior blocking finding f2 remains unresolved. Explicitly supplied DesignContextFiles are still accepted without per-entry resolution, so invalid refs proceed to reviewer selection instead of failing with design-context-unresolved: and status unresolved_design_context; the required mixed/all-invalid reviewer-never-invoked tests are still absent. The worktree-visible state.md lines 320-338 acknowledges the blocker but explicitly says the maintainer decision is pending, so it is not a recorded human-approved deferral. Stop the autonomous review/fix loop and have the maintainer choose either implementing T034b strict resolution and paired tests or recording a qualifying visible deferral with approver and carry destination.",
      "disposition": "escalated_to_human",
      "resolution": {
        "state": "unresolved",
        "fix_evidence_ref": null,
        "rationale": null
      }
    }
  ],
  "created_at": "2026-07-12T01:08:51Z"
}