{
  "schema_version": "1.0",
  "run_id": "run-197-fixture-consumer-001",
  "status": "findings",
  "findings": [
    {
      "finding_id": "finding-consumer-001",
      "source_run_id": "run-197-fixture-consumer-001",
      "location": {
        "path": "specs/197-continuous-co-review/plan.md",
        "line_start": 1,
        "line_end": 1
      },
      "severity": "advisory",
      "kind": "fixture-advisory",
      "design_reference": "INT-002",
      "comment": "Consumer fixture advisory finding.",
      "disposition": "open",
      "resolution": {
        "state": "unresolved"
      }
    }
  ],
  "created_at": "2026-06-17T21:03:00Z"
}
