{
  "schema_version": "1.0",
  "run_id": "20260711T163540953-1446b84c",
  "status": "findings",
  "findings": [
    {
      "finding_id": "f1",
      "source_run_id": "20260711T163540953-1446b84c",
      "location": {
        "path": "scripts/internal/continuous-co-review/tracker-honesty-check.ps1",
        "line_start": 54,
        "line_end": 63
      },
      "severity": "blocking",
      "kind": "fail-open-tracker-bypass",
      "design_reference": "FR-020 / NFR-001 / specs/198-beta2-hardening/data-model.md:99-114 / code-implementation and test-integrity lenses",
      "comment": "The honesty checker does not parse the authoritative TrackerClaims shape. Get-ContinuousCoReviewStateClaims reads only Iteration Status and Last Completed Task, while the formal data model requires task_statuses and defines capacity/test-count claims; it also accepts any nonmatching Last Completed Task text and any [a-z-]+ status, then treats those unmapped claims as honest. A tracker-only edit can therefore add or alter unparsed capacity/test-count claims (or use an unknown task/status form) and retain stale review evidence, contradicting the required fail-closed behavior. Parse every claim-bearing field with canonical enums/shapes, compare it to accepted review/run evidence, and add abuse tests proving unmapped/invalid claims decline the bypass.",
      "disposition": "open",
      "resolution": {
        "state": "unresolved",
        "fix_evidence_ref": null,
        "rationale": null
      }
    }
  ],
  "created_at": "2026-07-11T16:39:40Z"
}